<?xml version="1.0" encoding="UTF-8"?>
<comanda id="P03"
xmlns:xs="http://www.w3.org/2001/XMLSchema-instance"
xs:noNamespaceSchemaLocation="5.1.xsd">
    <client>
        <nom>Pau</nom>
        <email>pau@email</email>
    </client>
    <linia numero="1">
        <article>Teclat</article>
        <quantitat>-2</quantitat>
        <preu_unitari>25.502</preu_unitari>
    </linia>
</comanda>